{
  "$schema": "https://json-schema.org/draft/2020-12/schema",
  "title": "ResidualOps Second-Run Feedback Memory",
  "type": "object",
  "required": ["schema", "memory_update_id", "second_run_id", "updated_entries"],
  "properties": {
    "schema": { "const": "ResidualOps_SecondRunFeedbackMemory/v0.1" },
    "memory_update_id": { "type": "string" },
    "second_run_id": { "type": "string" },
    "generated_at": { "type": "string" },
    "updated_entries": { "type": "array", "items": { "type": "object" } },
    "portfolio_next_actions": { "type": "array", "items": { "type": "string" } },
    "external_action_authorized": { "type": "boolean" }
  },
  "additionalProperties": true
}
